<?xml version="1.0" encoding="UTF-8"?>
<ids:ids xmlns:ids="http://standards.buildingsmart.org/IDS"
         xmlns:xsi="http://www.w3.org/2001/XMLSchema-instance"
         xsi:schemaLocation="http://standards.buildingsmart.org/IDS IDS-1.0.xsd">
  <ids:info>
    <ids:title>Entity-only specification</ids:title>
    <ids:copyright>OpenConstructionERP test fixtures</ids:copyright>
    <ids:version>1.0.0</ids:version>
    <ids:description>All instances must be IfcWall.</ids:description>
    <ids:author>fixtures@openconstructionerp.io</ids:author>
    <ids:date>2026-04-25</ids:date>
    <ids:purpose>Round-trip test (entity facet only).</ids:purpose>
  </ids:info>
  <ids:specifications>
    <ids:specification name="All walls present" ifcVersion="IFC4" identifier="ids_01" description="Entity facet only — every applicable element must exist as IfcWall.">
      <ids:applicability minOccurs="1" maxOccurs="unbounded">
        <ids:entity>
          <ids:name>
            <ids:simpleValue>IFCWALL</ids:simpleValue>
          </ids:name>
        </ids:entity>
      </ids:applicability>
      <ids:requirements>
        <ids:entity>
          <ids:name>
            <ids:simpleValue>IFCWALL</ids:simpleValue>
          </ids:name>
        </ids:entity>
      </ids:requirements>
    </ids:specification>
  </ids:specifications>
</ids:ids>
