<?xml version="1.0" encoding="UTF-8"?>
<ids:ids xmlns:ids="http://standards.buildingsmart.org/IDS"
         xmlns:xsi="http://www.w3.org/2001/XMLSchema-instance"
         xsi:schemaLocation="http://standards.buildingsmart.org/IDS IDS-1.0.xsd">
  <ids:info>
    <ids:title>Combined LOD300 deliverable</ids:title>
    <ids:copyright>OpenConstructionERP test fixtures</ids:copyright>
    <ids:version>1.0.0</ids:version>
    <ids:description>Three specifications in one IDS file: walls have IsExternal, slabs have LoadBearing, doors have FireRating.</ids:description>
    <ids:author>fixtures@openconstructionerp.io</ids:author>
    <ids:date>2026-04-25</ids:date>
    <ids:milestone>LOD300</ids:milestone>
  </ids:info>
  <ids:specifications>
    <ids:specification name="Walls have IsExternal" ifcVersion="IFC4" identifier="ids_10_walls">
      <ids:applicability minOccurs="1" maxOccurs="unbounded">
        <ids:entity>
          <ids:name>
            <ids:simpleValue>IFCWALL</ids:simpleValue>
          </ids:name>
        </ids:entity>
      </ids:applicability>
      <ids:requirements>
        <ids:property cardinality="required" dataType="IFCBOOLEAN">
          <ids:propertySet>
            <ids:simpleValue>Pset_WallCommon</ids:simpleValue>
          </ids:propertySet>
          <ids:baseName>
            <ids:simpleValue>IsExternal</ids:simpleValue>
          </ids:baseName>
        </ids:property>
      </ids:requirements>
    </ids:specification>
    <ids:specification name="Slabs have LoadBearing" ifcVersion="IFC4" identifier="ids_10_slabs">
      <ids:applicability minOccurs="1" maxOccurs="unbounded">
        <ids:entity>
          <ids:name>
            <ids:simpleValue>IFCSLAB</ids:simpleValue>
          </ids:name>
        </ids:entity>
      </ids:applicability>
      <ids:requirements>
        <ids:property cardinality="required" dataType="IFCBOOLEAN">
          <ids:propertySet>
            <ids:simpleValue>Pset_SlabCommon</ids:simpleValue>
          </ids:propertySet>
          <ids:baseName>
            <ids:simpleValue>LoadBearing</ids:simpleValue>
          </ids:baseName>
        </ids:property>
      </ids:requirements>
    </ids:specification>
    <ids:specification name="Doors have FireRating" ifcVersion="IFC4" identifier="ids_10_doors">
      <ids:applicability minOccurs="1" maxOccurs="unbounded">
        <ids:entity>
          <ids:name>
            <ids:simpleValue>IFCDOOR</ids:simpleValue>
          </ids:name>
        </ids:entity>
      </ids:applicability>
      <ids:requirements>
        <ids:property cardinality="required" dataType="IFCLABEL">
          <ids:propertySet>
            <ids:simpleValue>Pset_DoorCommon</ids:simpleValue>
          </ids:propertySet>
          <ids:baseName>
            <ids:simpleValue>FireRating</ids:simpleValue>
          </ids:baseName>
        </ids:property>
      </ids:requirements>
    </ids:specification>
  </ids:specifications>
</ids:ids>
